{
  "analysis": {
    "summary": "Миграция меняет nullable legacy-поле на структурированный составной ключ. Критичны безопасная обработка истории, явная политика видимости и уникальность новых идентификаторов.",
    "scope": [
      "Обработка null в legacy-ключе",
      "Политика видимости по типу источника",
      "Уникальность составного ключа",
      "Поведение по умолчанию для неизвестных типов"
    ],
    "risks": [
      {
        "risk": "Доступ к вложенному ключу падает на исторической записи.",
        "mitigation": "Обрабатывать отсутствие ключа как явную legacy-ветку."
      },
      {
        "risk": "Две записи источника получают один составной идентификатор.",
        "mitigation": "Сравнивать каноническое сериализованное представление ключей новых записей."
      }
    ]
  },
  "algorithm": {
    "steps": [
      "Загрузить legacy-запись без структурированного ключа.",
      "Проверить видимость для null, разрешенных и неописанных типов источника.",
      "Сериализовать каждый новый составной ключ в каноническом порядке.",
      "Убедиться, что сериализованные ключи уникальны."
    ],
    "evidence": [
      "Результат безопасной обработки legacy-записи.",
      "Результат видимости для каждого типа источника.",
      "Канонические значения составных ключей и результат проверки уникальности."
    ]
  },
  "automated_checks": [
    {
      "id": "AUTO-001",
      "purpose": "Проверить безопасную обработку null в legacy-ключе.",
      "expected": "Legacy-запись видима, исключение не возникает."
    },
    {
      "id": "AUTO-002",
      "purpose": "Проверить политику видимости типов источника.",
      "expected": "Видимы только настроенные типы, неописанный тип скрыт."
    },
    {
      "id": "AUTO-003",
      "purpose": "Проверить уникальность новых составных идентификаторов.",
      "expected": "Каждая новая запись имеет отдельный канонический ключ."
    }
  ],
  "manual_checks": [
    {
      "id": "MANUAL-001",
      "purpose": "Проверить выборку миграции с частично заполненными историческими записями.",
      "expected": "Записи явно классифицируются или отражаются в отчете, ни одна не исчезает молча."
    },
    {
      "id": "MANUAL-002",
      "purpose": "Исследовать типы источников и формы вложенных ключей вне allow-list.",
      "expected": "Сервис применяет предсказуемое значение по умолчанию и при необходимости дает полезную диагностику."
    }
  ],
  "assumptions": [
    "Null-ключ означает известное legacy-состояние.",
    "Список разрешенных типов источников принадлежит продуктовой команде."
  ],
  "limitations": [
    "Reference checks работают на локальных синтетических записях и не валидируют миграцию базы или деплой сервиса.",
    "Для объема данных, наблюдаемости и сценария отката остается необходимым ручное исследование."
  ]
}
