{
  "analysis": {
    "summary": "Изменение затрагивает состояние калькулятора, маршрутизацию каталога, сериализацию URL и независимость состояний каталогов. Успешный переход должен сохранять именно выбранные значения, а не просто открывать корректную страницу.",
    "scope": [
      "Выбранный каталог",
      "Поддерживаемые фильтры калькулятора",
      "Параметры URL целевой страницы",
      "Изоляция второго каталога"
    ],
    "risks": [
      {
        "risk": "Один из фильтров незаметно сбрасывается, хотя каталог открывается.",
        "mitigation": "Сравнивать каждый поддерживаемый фильтр до и после перехода."
      },
      {
        "risk": "Общий параметр URL переносит значение между каталогами.",
        "mitigation": "Проверять независимый контрольный каталог с другими значениями."
      }
    ]
  },
  "algorithm": {
    "steps": [
      "Подготовить выбранный каталог и полный набор фильтров калькулятора.",
      "Перейти из калькулятора в выбранный каталог.",
      "Сравнить каталог, каждый фильтр и параметры URL с исходным состоянием.",
      "Повторить проверку с независимым контрольным каталогом для поиска утечки состояния."
    ],
    "evidence": [
      "Сериализованное исходное и целевое состояние.",
      "Сериализованные параметры URL.",
      "JSON-отчет reference checks с результатом каждой проверки."
    ]
  },
  "automated_checks": [
    {
      "id": "AUTO-001",
      "purpose": "Проверить, что после перехода остается выбранным нужный каталог.",
      "expected": "Целевой каталог имеет значение pre-owned."
    },
    {
      "id": "AUTO-002",
      "purpose": "Проверить совпадение всех настроенных фильтров и параметров URL с исходным состоянием.",
      "expected": "Ежемесячный платеж, срок и тип оплаты не меняются ни в состоянии, ни в URL."
    },
    {
      "id": "AUTO-003",
      "purpose": "Проверить, что другой каталог сохраняет собственное состояние.",
      "expected": "Контрольный каталог остается new с исходными значениями."
    }
  ],
  "manual_checks": [
    {
      "id": "MANUAL-001",
      "purpose": "Исследовать историю браузера, обновление страницы и прямой переход по URL с корректными фильтрами.",
      "expected": "Видимые контролы и результаты соответствуют URL, значения не меняются неожиданно."
    },
    {
      "id": "MANUAL-002",
      "purpose": "Проверить граничные и неподдерживаемые комбинации фильтров.",
      "expected": "Интерфейс дает понятный результат и не смешивает состояние каталогов."
    }
  ],
  "assumptions": [
    "Все поддерживаемые фильтры имеют стабильное представление в URL.",
    "Целевой каталог принимает тот же домен фильтров, что и калькулятор."
  ],
  "limitations": [
    "Reference checks проверяют только синтетическое сериализованное состояние и не заменяют браузерную сессию или проверку в production.",
    "Для рендеринга, доступности и неожиданных пользовательских сценариев остаются обязательными ручные исследовательские проверки."
  ]
}
